AI Trend,Description,Impact
Generative AI,"AI models like GPT-4 and Gemini generate text, images, and code.",Revolutionizing content creation and automation.
AI in Healthcare,"AI assists in diagnostics, robotic surgery, and drug discovery.",Improves medical accuracy and efficiency.
Autonomous Vehicles,Self-driving cars use AI for navigation and safety.,Reduces accidents and enhances mobility.
AI in Finance,"AI-powered trading, fraud detection, and risk assessment.",Optimizes financial decision-making.
AI in Education,Personalized learning platforms using AI tutors and assessments.,Enhances student engagement and performance.
Ethical AI,"Ensuring AI fairness, transparency, and bias reduction.",Promotes responsible AI usage and trust.
AI and Cybersecurity,AI-driven threat detection and security automation.,Enhances data protection and network security.
Quantum AI,AI combined with quantum computing for complex problem-solving.,Speeds up computations and scientific discoveries.
AI Hardware,Specialized chips like NVIDIA’s AI GPUs.,Boosts AI processing power and efficiency.
